{
  "$schema": "https://json-schema.org/draft/2020-12/schema",
  "$id": "https://fika.invalid/schemas/pack-3/requested-work-input.schema.json",
  "title": "Requested Work Input",
  "description": "Demand input into the shared fulfilment workflow while preserving source classification. Draft business schema derived from approved Pack 3 BDR authority; not an implementation model.",
  "type": "object",
  "additionalProperties": false,
  "required": [
    "schemaVersion",
    "requestedWorkInputId",
    "classification",
    "sourceType",
    "requestedDateTime",
    "status",
    "provenance",
    "audit"
  ],
  "properties": {
    "schemaVersion": {
      "type": "string",
      "const": "pack-3-draft-1"
    },
    "requestedWorkInputId": {
      "$ref": "#/$defs/stableId"
    },
    "classification": {
      "type": "string",
      "enum": [
        "hospitality_booking",
        "recurring_operational_request",
        "event_request",
        "other"
      ]
    },
    "sourceType": {
      "type": "string",
      "enum": [
        "hospitality_booking",
        "recurring_schedule",
        "event",
        "manual",
        "other"
      ]
    },
    "serviceArrangementId": {
      "$ref": "#/$defs/stableId"
    },
    "serviceId": {
      "$ref": "#/$defs/stableId"
    },
    "requestedDateTime": {
      "$ref": "#/$defs/isoDateTime"
    },
    "destination": {
      "type": "string"
    },
    "quantitiesSummary": {
      "type": "string"
    },
    "status": {
      "type": "string",
      "enum": [
        "requested",
        "planned",
        "cancelled",
        "fulfilled",
        "declined"
      ]
    },
    "provenance": {
      "$ref": "#/$defs/provenance"
    },
    "audit": {
      "$ref": "#/$defs/audit"
    }
  },
  "$defs": {
    "stableId": {
      "type": "string",
      "minLength": 1,
      "pattern": "^[A-Za-z][A-Za-z0-9_.:-]*$"
    },
    "isoDateTime": {
      "type": "string",
      "format": "date-time"
    },
    "scopeType": {
      "type": "string",
      "enum": [
        "organisation",
        "domain",
        "operational_location",
        "service",
        "service_arrangement",
        "event",
        "equipment_asset",
        "client",
        "other"
      ]
    },
    "scope": {
      "type": "object",
      "additionalProperties": false,
      "required": [
        "scopeType",
        "scopeId"
      ],
      "properties": {
        "scopeType": {
          "$ref": "#/$defs/scopeType"
        },
        "scopeId": {
          "$ref": "#/$defs/stableId"
        },
        "scopeLabel": {
          "type": "string"
        }
      }
    },
    "effectivePeriod": {
      "type": "object",
      "additionalProperties": false,
      "required": [
        "startAt"
      ],
      "properties": {
        "startAt": {
          "$ref": "#/$defs/isoDateTime"
        },
        "endAt": {
          "type": [
            "string",
            "null"
          ],
          "format": "date-time"
        },
        "reason": {
          "type": "string"
        }
      }
    },
    "approval": {
      "type": "object",
      "additionalProperties": false,
      "required": [
        "approvedBy",
        "approvedAt",
        "authorityGrantId",
        "reason"
      ],
      "properties": {
        "approvedBy": {
          "$ref": "#/$defs/stableId"
        },
        "approvedAt": {
          "$ref": "#/$defs/isoDateTime"
        },
        "authorityGrantId": {
          "$ref": "#/$defs/stableId"
        },
        "reason": {
          "type": "string"
        }
      }
    },
    "auditEvent": {
      "type": "object",
      "additionalProperties": false,
      "required": [
        "eventType",
        "occurredAt",
        "actorId"
      ],
      "properties": {
        "eventType": {
          "type": "string"
        },
        "occurredAt": {
          "$ref": "#/$defs/isoDateTime"
        },
        "actorId": {
          "$ref": "#/$defs/stableId"
        },
        "reason": {
          "type": "string"
        }
      }
    },
    "audit": {
      "type": "object",
      "additionalProperties": false,
      "required": [
        "version",
        "createdAt",
        "createdBy",
        "updatedAt",
        "updatedBy",
        "events"
      ],
      "properties": {
        "version": {
          "type": "integer",
          "minimum": 1
        },
        "createdAt": {
          "$ref": "#/$defs/isoDateTime"
        },
        "createdBy": {
          "$ref": "#/$defs/stableId"
        },
        "updatedAt": {
          "$ref": "#/$defs/isoDateTime"
        },
        "updatedBy": {
          "$ref": "#/$defs/stableId"
        },
        "events": {
          "type": "array",
          "items": {
            "$ref": "#/$defs/auditEvent"
          }
        }
      }
    },
    "provenance": {
      "type": "object",
      "additionalProperties": false,
      "required": [
        "sourceBdrIds",
        "sourceSnapshot",
        "authorityRank"
      ],
      "properties": {
        "sourceBdrIds": {
          "type": "array",
          "minItems": 1,
          "items": {
            "type": "string",
            "pattern": "^SVC-\\d{3}$"
          }
        },
        "sourceSnapshot": {
          "type": "string"
        },
        "authorityRank": {
          "type": "string",
          "enum": [
            "Approved Canon",
            "Approved Governed Decision Register",
            "Approved canonical Decision",
            "Review Doctrine and Authority Model"
          ]
        }
      }
    }
  },
  "x-fika-source-bdrs": [
    "SVC-006",
    "SVC-005"
  ],
  "x-fika-status": "Draft for human review; not adopted"
}
